<?xml version="1.0" encoding="UTF-8"?>
<xs:schema xmlns:xs="http://www.w3.org/2001/XMLSchema">
	<xs:element name="list">
		<xs:complexType>
			<xs:sequence maxOccurs="1" minOccurs="1">
				<xs:element name="set" maxOccurs="unbounded" minOccurs="1">
					<xs:complexType>
						<xs:sequence maxOccurs="1" minOccurs="1">
							<xs:element name="item" minOccurs="1" maxOccurs="unbounded">
								<xs:complexType>
									<xs:attribute name="id" type="xs:positiveInteger" use="required" />
								</xs:complexType>
							</xs:element>
							<xs:element name="bonus_item" maxOccurs="unbounded" minOccurs="0">
								<xs:complexType>
									<xs:attribute name="id" type="xs:positiveInteger" use="required" />
								</xs:complexType>
							</xs:element>
							<xs:element name="skill" maxOccurs="unbounded" minOccurs="1">
								<xs:complexType>
									<xs:attribute name="set" type="xs:positiveInteger" use="required" />
									<xs:attribute name="id" type="xs:positiveInteger" use="required" />
									<xs:attribute name="level" type="xs:positiveInteger" use="required" />
								</xs:complexType>
							</xs:element>
							<xs:element name="bonus_skill" minOccurs="0" maxOccurs="unbounded" >
								<xs:complexType>
									<xs:attribute name="id" type="xs:positiveInteger" use="required" />
									<xs:attribute name="level" type="xs:positiveInteger" use="required" />
								</xs:complexType>
							</xs:element>
							<xs:element name="enchant_skill" maxOccurs="unbounded" minOccurs="0">
								<xs:complexType>
									<xs:attribute name="enchantLevel" type="xs:positiveInteger" use="required" />
									<xs:attribute name="id" type="xs:positiveInteger" use="required" />
									<xs:attribute name="level" type="xs:positiveInteger" use="required" />
								</xs:complexType>
							</xs:element>
						</xs:sequence>
						<xs:attribute name="id" use="required" type="xs:positiveInteger" />
					</xs:complexType>
				</xs:element>
			</xs:sequence>
		</xs:complexType>
	</xs:element>
</xs:schema>