<?xml version="1.0" encoding="UTF-8"?>
<list xmlns:xsi="http://www.w3.org/2001/XMLSchema-instance" xsi:noNamespaceSchemaLocation="../../xsd/armorSets.xsd">
	<!-- S84 Vorpal PVP Armor Sets -->
	<set id="194">
		<item id="16171" /> <!-- Vorpal Breastplate {PvP} -->
		<item id="15595" /> <!-- Vorpal Gaiter -->
		<item id="15589" /> <!-- Vorpal Helmet -->
		<item id="15598" /> <!-- Vorpal Gauntlet -->
		<item id="15601" /> <!-- Vorpal Boots -->
		<bonus_item id="15604" /> <!-- Vorpal Shield -->
		<skill set="5" id="3006" level="1" /> <!-- Equip Set Items -->
		<skill set="5" id="8409" level="1" /> <!-- Vorpal Heavy Armor Set - PVP -->
		<bonus_skill id="8495" level="1" /> <!-- Vorpal Shield -->
		<enchant_skill enchantLevel="6" id="8461" level="1" /> <!-- Enchant Heavy Armor (S Grade) -->
	</set>
	<set id="195">
		<item id="16172" /> <!-- Vorpal Leather Breastplate {PvP} -->
		<item id="15596" /> <!-- Vorpal Leather Legging -->
		<item id="15590" /> <!-- Vorpal Leather Helmet -->
		<item id="15599" /> <!-- Vorpal Leather Gloves -->
		<item id="15602" /> <!-- Vorpal Leather Boots -->
		<skill set="5" id="3006" level="1" /> <!-- Equip Set Items -->
		<skill set="5" id="8410" level="1" /> <!-- Vorpal Leather Armor Set - PVP -->
		<enchant_skill enchantLevel="6" id="8462" level="1" /> <!-- Enchant Light Armor (S Grade) -->
	</set>
	<set id="196">
		<item id="16173" /> <!-- Vorpal Tunic {PvP} -->
		<item id="15597" /> <!-- Vorpal Stockings -->
		<item id="15591" /> <!-- Vorpal Circlet -->
		<item id="15600" /> <!-- Vorpal Gloves -->
		<item id="15603" /> <!-- Vorpal Shoes -->
		<skill set="5" id="3006" level="1" /> <!-- Equip Set Items -->
		<skill set="5" id="8411" level="1" /> <!-- Vorpal Robe Set - PVP -->
		<enchant_skill enchantLevel="6" id="8463" level="1" /> <!-- Enchant Robe (S Grade) -->
	</set>
</list>